{
  "diagnostics": [],
  "edge_ids": [
    "e-acc-decl-acc-prev-READS-value",
    "e-acc-decl-acc-result-READS-value",
    "e-acc-prev-update-PREVIOUS_ACCUMULATOR_VALUE-accumulator",
    "e-acc-result-return-RESULT_OF-return_value",
    "e-i-decl-loop-LOOP_BOUND_DEPENDS_ON-index",
    "e-i-ref-x-index-VALUE_DEPENDS_ON-arg1",
    "e-init-acc-decl-DEFINES-initial_value",
    "e-loop-update-CONTROL_GUARDS-loop",
    "e-n-ref-loop-LOOP_BOUND_DEPENDS_ON-upper",
    "e-update-acc-decl-DEFINES-assigned_value",
    "e-x-index-update-VALUE_DEPENDS_ON-value",
    "e-zero-loop-LOOP_BOUND_DEPENDS_ON-lower"
  ],
  "edges": [
    {
      "argument_role": "value",
      "confidence": "RESOLVED",
      "derivation": "clang_ast",
      "edge_id": "e-acc-decl-acc-prev-READS-value",
      "kind": "READS",
      "source_node_id": "acc-decl",
      "source_span": {
        "begin_column": 1,
        "begin_line": 1,
        "end_column": 20,
        "end_line": 1,
        "file": "tests/golden/pr3a/fixtures/fold_left/source.cpp"
      },
      "target_node_id": "acc-prev"
    },
    {
      "argument_role": "value",
      "confidence": "RESOLVED",
      "derivation": "clang_ast",
      "edge_id": "e-acc-decl-acc-result-READS-value",
      "kind": "READS",
      "source_node_id": "acc-decl",
      "source_span": {
        "begin_column": 1,
        "begin_line": 1,
        "end_column": 20,
        "end_line": 1,
        "file": "tests/golden/pr3a/fixtures/fold_left/source.cpp"
      },
      "target_node_id": "acc-result"
    },
    {
      "argument_role": "accumulator",
      "confidence": "RESOLVED",
      "derivation": "clang_ast",
      "edge_id": "e-acc-prev-update-PREVIOUS_ACCUMULATOR_VALUE-accumulator",
      "kind": "PREVIOUS_ACCUMULATOR_VALUE",
      "source_node_id": "acc-prev",
      "source_span": {
        "begin_column": 1,
        "begin_line": 1,
        "end_column": 20,
        "end_line": 1,
        "file": "tests/golden/pr3a/fixtures/fold_left/source.cpp"
      },
      "target_node_id": "update"
    },
    {
      "argument_role": "return_value",
      "confidence": "RESOLVED",
      "derivation": "clang_ast",
      "edge_id": "e-acc-result-return-RESULT_OF-return_value",
      "kind": "RESULT_OF",
      "source_node_id": "acc-result",
      "source_span": {
        "begin_column": 1,
        "begin_line": 1,
        "end_column": 20,
        "end_line": 1,
        "file": "tests/golden/pr3a/fixtures/fold_left/source.cpp"
      },
      "target_node_id": "return"
    },
    {
      "argument_role": "index",
      "confidence": "RESOLVED",
      "derivation": "clang_ast",
      "edge_id": "e-i-decl-loop-LOOP_BOUND_DEPENDS_ON-index",
      "kind": "LOOP_BOUND_DEPENDS_ON",
      "source_node_id": "i-decl",
      "source_span": {
        "begin_column": 1,
        "begin_line": 1,
        "end_column": 20,
        "end_line": 1,
        "file": "tests/golden/pr3a/fixtures/fold_left/source.cpp"
      },
      "target_node_id": "loop"
    },
    {
      "argument_role": "arg1",
      "confidence": "RESOLVED",
      "derivation": "clang_ast",
      "edge_id": "e-i-ref-x-index-VALUE_DEPENDS_ON-arg1",
      "kind": "VALUE_DEPENDS_ON",
      "source_node_id": "i-ref",
      "source_span": {
        "begin_column": 1,
        "begin_line": 1,
        "end_column": 20,
        "end_line": 1,
        "file": "tests/golden/pr3a/fixtures/fold_left/source.cpp"
      },
      "target_node_id": "x-index"
    },
    {
      "argument_role": "initial_value",
      "confidence": "RESOLVED",
      "derivation": "clang_ast",
      "edge_id": "e-init-acc-decl-DEFINES-initial_value",
      "kind": "DEFINES",
      "source_node_id": "init",
      "source_span": {
        "begin_column": 1,
        "begin_line": 1,
        "end_column": 20,
        "end_line": 1,
        "file": "tests/golden/pr3a/fixtures/fold_left/source.cpp"
      },
      "target_node_id": "acc-decl"
    },
    {
      "argument_role": "loop",
      "confidence": "RESOLVED",
      "derivation": "clang_ast",
      "edge_id": "e-loop-update-CONTROL_GUARDS-loop",
      "kind": "CONTROL_GUARDS",
      "source_node_id": "loop",
      "source_span": {
        "begin_column": 1,
        "begin_line": 1,
        "end_column": 20,
        "end_line": 1,
        "file": "tests/golden/pr3a/fixtures/fold_left/source.cpp"
      },
      "target_node_id": "update"
    },
    {
      "argument_role": "upper",
      "confidence": "RESOLVED",
      "derivation": "clang_ast",
      "edge_id": "e-n-ref-loop-LOOP_BOUND_DEPENDS_ON-upper",
      "kind": "LOOP_BOUND_DEPENDS_ON",
      "source_node_id": "n-ref",
      "source_span": {
        "begin_column": 1,
        "begin_line": 1,
        "end_column": 20,
        "end_line": 1,
        "file": "tests/golden/pr3a/fixtures/fold_left/source.cpp"
      },
      "target_node_id": "loop"
    },
    {
      "argument_role": "assigned_value",
      "confidence": "RESOLVED",
      "derivation": "clang_ast",
      "edge_id": "e-update-acc-decl-DEFINES-assigned_value",
      "kind": "DEFINES",
      "source_node_id": "update",
      "source_span": {
        "begin_column": 1,
        "begin_line": 1,
        "end_column": 20,
        "end_line": 1,
        "file": "tests/golden/pr3a/fixtures/fold_left/source.cpp"
      },
      "target_node_id": "acc-decl"
    },
    {
      "argument_role": "value",
      "confidence": "RESOLVED",
      "derivation": "clang_ast",
      "edge_id": "e-x-index-update-VALUE_DEPENDS_ON-value",
      "kind": "VALUE_DEPENDS_ON",
      "source_node_id": "x-index",
      "source_span": {
        "begin_column": 1,
        "begin_line": 1,
        "end_column": 20,
        "end_line": 1,
        "file": "tests/golden/pr3a/fixtures/fold_left/source.cpp"
      },
      "target_node_id": "update"
    },
    {
      "argument_role": "lower",
      "confidence": "RESOLVED",
      "derivation": "clang_ast",
      "edge_id": "e-zero-loop-LOOP_BOUND_DEPENDS_ON-lower",
      "kind": "LOOP_BOUND_DEPENDS_ON",
      "source_node_id": "zero",
      "source_span": {
        "begin_column": 1,
        "begin_line": 1,
        "end_column": 20,
        "end_line": 1,
        "file": "tests/golden/pr3a/fixtures/fold_left/source.cpp"
      },
      "target_node_id": "loop"
    }
  ],
  "node_ids": [
    "acc-decl",
    "acc-prev",
    "acc-result",
    "i-decl",
    "i-ref",
    "init",
    "loop",
    "n-ref",
    "return",
    "update",
    "x-index",
    "zero"
  ],
  "nodes": [
    {
      "attributes": {
        "initializer_text": "2.0",
        "name": "acc",
        "semantic_kind": "LocalVariable"
      },
      "constness": "mutable",
      "cpp_type": "double",
      "effect": "Pure",
      "id": "acc-decl",
      "kind": "VarDecl",
      "resolved_symbol": "",
      "source_span": {
        "begin_column": 1,
        "begin_line": 1,
        "end_column": 20,
        "end_line": 1,
        "file": "tests/golden/pr3a/fixtures/fold_left/source.cpp"
      },
      "value_category": "prvalue"
    },
    {
      "attributes": {
        "name": "acc",
        "semantic_kind": "Load"
      },
      "constness": "mutable",
      "cpp_type": "double",
      "effect": "Pure",
      "id": "acc-prev",
      "kind": "DeclRefExpr",
      "resolved_symbol": "",
      "source_span": {
        "begin_column": 1,
        "begin_line": 1,
        "end_column": 20,
        "end_line": 1,
        "file": "tests/golden/pr3a/fixtures/fold_left/source.cpp"
      },
      "value_category": "prvalue"
    },
    {
      "attributes": {
        "name": "acc",
        "semantic_kind": "Load"
      },
      "constness": "mutable",
      "cpp_type": "double",
      "effect": "Pure",
      "id": "acc-result",
      "kind": "DeclRefExpr",
      "resolved_symbol": "",
      "source_span": {
        "begin_column": 1,
        "begin_line": 1,
        "end_column": 20,
        "end_line": 1,
        "file": "tests/golden/pr3a/fixtures/fold_left/source.cpp"
      },
      "value_category": "prvalue"
    },
    {
      "attributes": {
        "name": "i",
        "semantic_kind": "LocalVariable"
      },
      "constness": "mutable",
      "cpp_type": "double",
      "effect": "Pure",
      "id": "i-decl",
      "kind": "VarDecl",
      "resolved_symbol": "",
      "source_span": {
        "begin_column": 1,
        "begin_line": 1,
        "end_column": 20,
        "end_line": 1,
        "file": "tests/golden/pr3a/fixtures/fold_left/source.cpp"
      },
      "value_category": "prvalue"
    },
    {
      "attributes": {
        "name": "i",
        "semantic_kind": "Load"
      },
      "constness": "mutable",
      "cpp_type": "double",
      "effect": "Pure",
      "id": "i-ref",
      "kind": "DeclRefExpr",
      "resolved_symbol": "",
      "source_span": {
        "begin_column": 1,
        "begin_line": 1,
        "end_column": 20,
        "end_line": 1,
        "file": "tests/golden/pr3a/fixtures/fold_left/source.cpp"
      },
      "value_category": "prvalue"
    },
    {
      "attributes": {
        "semantic_kind": "Literal",
        "value": "2.0"
      },
      "constness": "mutable",
      "cpp_type": "double",
      "effect": "Pure",
      "id": "init",
      "kind": "FloatingLiteral",
      "resolved_symbol": "",
      "source_span": {
        "begin_column": 1,
        "begin_line": 1,
        "end_column": 20,
        "end_line": 1,
        "file": "tests/golden/pr3a/fixtures/fold_left/source.cpp"
      },
      "value_category": "prvalue"
    },
    {
      "attributes": {
        "comparison": "<",
        "index": "i",
        "lower": "0",
        "semantic_kind": "Loop",
        "upper": "n"
      },
      "constness": "mutable",
      "cpp_type": "double",
      "effect": "Pure",
      "id": "loop",
      "kind": "ForStmt",
      "resolved_symbol": "",
      "source_span": {
        "begin_column": 1,
        "begin_line": 1,
        "end_column": 20,
        "end_line": 1,